# name: test/sql/birdshot.test
# description: birdshot auth/authz hooks, ACL, revocation, audit (dev mode)
# group: [sql]
#
# This suite calls birdshot_authorize() IN-PROCESS (decision logic). Its
# end-to-end companion, test/e2e/birdshot.e2e.ts (`make test-e2e`), replays every
# authorize assertion below through a real quack client↔server with birdshot wired
# in as the auth/authz hooks, proving each decision is enforced on the wire.

# Functions don't exist before the extension is loaded.
statement error
SELECT birdshot_status();
----
Catalog Error

require birdshot

# ---- configure (dev mode: JWT claims trusted without signature) -------------

query I
SELECT birdshot_reset_config();
----
ok

query I
SELECT birdshot_set_auth('', '', 'dev');
----
ok

# role 'reader' may read main.todos; 'peer' service token maps to it.
query I
SELECT birdshot_add_role_grant('reader', 'main.todos', 'read');
----
ok

query I
SELECT birdshot_add_user_role('alice', 'reader');
----
ok

query I
SELECT birdshot_add_service_token('svc-token-123', 'alice');
----
ok

query I
SELECT birdshot_commit_config();
----
ok

query I
SELECT birdshot_status() LIKE 'mode=dev%';
----
true

# ---- catalog fixtures -------------------------------------------------------
#
# Bind-and-walk binds the query against the real catalog, so the tables an
# authorization test references must EXIST (a query over a non-existent table
# can't bind and is denied, fail-closed — which is correct). These mirror the
# lake tables that exist in production. `main.todos` is the granted table;
# `secrets` exists but is NOT granted, so its deny tests the real
# exists-but-ungranted property (not an incidental bind failure).

statement ok
CREATE TABLE main.todos(id INT, title VARCHAR);

statement ok
CREATE TABLE secrets(id INT, title VARCHAR);

# `whoami()` is a quack-provided node-identity table macro that exists in
# production (the authz hook runs on a quack connection). The bare test DB does not
# load quack, so bind-and-walk could not bind it; stub it to mirror prod. The
# pre-filter still allowlists it by NAME (IsSafeTableFunc), so this stays a real S7
# test — a non-allowlisted table function is denied at the pre-filter regardless.
statement ok
CREATE MACRO whoami() AS TABLE (SELECT 'node' AS node_id);

# ---- authentication ---------------------------------------------------------

# Static service token authenticates as user 'alice'.
query I
SELECT birdshot_authenticate('sess1', 'svc-token-123', 'ignored');
----
true

# A dev-mode user JWT { "sub": "alice" } also authenticates.
query I
SELECT birdshot_authenticate('sess2', 'eyJhbGciOiJub25lIiwidHlwIjoiSldUIn0.eyJzdWIiOiJhbGljZSJ9.x', '');
----
true

# Garbage token is rejected.
query I
SELECT birdshot_authenticate('sess3', 'not-a-token', '');
----
false

# ---- authorization ----------------------------------------------------------

# Granted read on main.todos -> allow.
query I
SELECT birdshot_authorize('sess1', 'SELECT * FROM main.todos');
----
true

# Unqualified todos matches the grant by suffix -> allow.
query I
SELECT birdshot_authorize('sess1', 'SELECT count(*) FROM todos');
----
true

# A table with no grant -> deny.
query I
SELECT birdshot_authorize('sess1', 'SELECT * FROM secrets');
----
false

# Write to a read-only granted table -> deny. (Well-formed arity so the denial is
# the write-grant check, not an incidental bind column-count error.)
query I
SELECT birdshot_authorize('sess1', 'INSERT INTO main.todos VALUES (1, ''x'')');
----
false

# Forbidden statement class (could subvert the sandbox) -> deny.
query I
SELECT birdshot_authorize('sess1', 'ATTACH ''evil.db'' AS x');
----
false

# Zero-table / introspection statement -> allowed (federation handshake).
query I
SELECT birdshot_authorize('sess1', 'SELECT 42');
----
true

# A non-granted table hidden in a WHERE subquery must NOT slip through.
query I
SELECT birdshot_authorize('sess1', 'SELECT * FROM main.todos WHERE id IN (SELECT id FROM secrets)');
----
false

# A forbidden statement hidden after a benign one in a batch must NOT slip through.
query I
SELECT birdshot_authorize('sess1', 'BEGIN; DROP TABLE main.todos');
----
false

# A peer must NOT be able to call birdshot's own mutators (zero-table SELECT).
query I
SELECT birdshot_authorize('sess1', 'SELECT birdshot_revoke(''user'', ''admin'', '''', NULL)');
----
false

query I
SELECT birdshot_authorize('sess1', 'SELECT birdshot_add_role_grant(''peer'', ''*'', ''write'')');
----
false

# File / dynamic readers must be denied (arbitrary file read / SSRF).
query I
SELECT birdshot_authorize('sess1', 'SELECT read_blob(''/etc/passwd'')');
----
false

query I
SELECT birdshot_authorize('sess1', 'SELECT * FROM read_csv(''/etc/passwd'')');
----
false

query I
SELECT birdshot_authorize('sess1', 'SELECT * FROM query_table(''secrets'')');
----
false

# A dangerous reader hidden in a WHERE subquery is still caught.
query I
SELECT birdshot_authorize('sess1', 'SELECT * FROM main.todos WHERE title = read_text(''/etc/hostname'')');
----
false

# EXPLAIN ANALYZE executes its child -> the child is ACL-checked, not waved through.
query I
SELECT birdshot_authorize('sess1', 'EXPLAIN ANALYZE SELECT * FROM secrets');
----
false

# Introspection table functions stay allowed (quack ATTACH handshake needs these).
query I
SELECT birdshot_authorize('sess1', 'SELECT * FROM duckdb_tables()');
----
true

# PRAGMA is denied (reparses into statements that skip re-authorize; some pragmas
# reach settings / file-write primitives).
query I
SELECT birdshot_authorize('sess1', 'PRAGMA table_info(''main.todos'')');
----
false

# A CAST to an autoload-backed type (json/spatial/inet) is denied even on a
# granted table — it can pull in an extension at bind time.
query I
SELECT birdshot_authorize('sess1', 'SELECT CAST(title AS JSON) FROM main.todos');
----
false

# Unknown session -> deny.
query I
SELECT birdshot_authorize('ghost', 'SELECT * FROM main.todos');
----
false

# ---- instant revocation -----------------------------------------------------

query I
SELECT birdshot_revoke('user', 'alice', 'compromised', NULL);
----
ok

# alice's existing session is cut off on her next query.
query I
SELECT birdshot_authorize('sess1', 'SELECT * FROM main.todos');
----
false

query I
SELECT birdshot_unrevoke('user', 'alice');
----
ok

query I
SELECT birdshot_authorize('sess1', 'SELECT * FROM main.todos');
----
true

# ---- audit drain ------------------------------------------------------------

# Every auth/authz call above logged an entry; draining returns them and clears.
query I
SELECT length(birdshot_log_drain(1000)) > 0;
----
true

query I
SELECT length(birdshot_log_drain(1000));
----
0

# ---- column + time-window constraint enforcement ----------------------------
#
# Real tables so positional refs (#N) resolve against the catalog. sqllogictest's
# default catalog is 'memory'; constraints resolve unqualified `FROM t` there.

statement ok
CREATE TABLE t(c1 INT, c2 INT, c3 INT, c4 INT, c5 INT GENERATED ALWAYS AS (c1 + 1));

statement ok
CREATE TABLE t2(c1 INT, c2 INT, c3 INT, c4 INT);

statement ok
CREATE TABLE win_tbl(c1 INT, c2 INT);

# Fresh config: bob may read t, t2, win_tbl; t is column-restricted to {c1,c2};
# win_tbl carries an all-day window (deterministic). t2 is unconstrained.
query I
SELECT birdshot_reset_config();
----
ok

query I
SELECT birdshot_set_auth('', '', 'dev');
----
ok

query I
SELECT birdshot_set_lake_catalog('memory');
----
ok

query I
SELECT birdshot_add_role_grant('colrole', 'main.t', 'read');
----
ok

query I
SELECT birdshot_add_role_grant('colrole', 'main.t2', 'read');
----
ok

query I
SELECT birdshot_add_role_grant('colrole', 'main.win_tbl', 'read');
----
ok

# Write grants so the DML (R6) cases reach column enforcement rather than
# denying at the table-grant stage. The {c1,c2} column constraint on main.t
# still applies to writes (column allow-lists are not action-scoped).
query I
SELECT birdshot_add_role_grant('colrole', 'main.t', 'write');
----
ok

query I
SELECT birdshot_add_role_grant('colrole', 'main.t2', 'write');
----
ok

query I
SELECT birdshot_add_grant_constraint('colrole', 'main.t', 'c1,c2', '', '');
----
ok

# All-day window -> always in-window (deterministic, not wall-clock-flaky).
query I
SELECT birdshot_add_grant_constraint('colrole', 'main.win_tbl', '', '00:00', '23:59');
----
ok

query I
SELECT birdshot_add_user_role('bob', 'colrole');
----
ok

query I
SELECT birdshot_commit_config();
----
ok

# Two constraint entries are live (main.t columns, main.win_tbl window).
query I
SELECT birdshot_status() LIKE '%constraints=2';
----
true

query I
SELECT birdshot_authenticate('bsess', 'eyJhbGciOiJub25lIiwidHlwIjoiSldUIn0.eyJzdWIiOiJib2IifQ.x', '');
----
true

# Form A (positional push-down): allowed columns -> allow; a non-allowed
# position (#3 == c3) -> deny; star pre-expanded to #1..#4 -> deny (c3,c4 not allowed).
query I
SELECT birdshot_authorize('bsess', 'SELECT #1, #2 FROM t');
----
true

query I
SELECT birdshot_authorize('bsess', 'SELECT #1, #3 FROM t');
----
false

query I
SELECT birdshot_authorize('bsess', 'SELECT #1, #2, #3, #4 FROM t');
----
false

# Form B (verbatim names via lake.query): allowed names -> allow; non-allowed
# name -> deny; literal unqualified star -> deny (cannot enumerate).
query I
SELECT birdshot_authorize('bsess', 'SELECT c1, c2 FROM main.t');
----
true

query I
SELECT birdshot_authorize('bsess', 'SELECT c1, c3 FROM main.t');
----
false

query I
SELECT birdshot_authorize('bsess', 'SELECT * FROM main.t');
----
false

# A non-allowed column hidden in a WHERE clause is also charged -> deny.
query I
SELECT birdshot_authorize('bsess', 'SELECT c1 FROM main.t WHERE c3 > 0');
----
false

# A non-allowed column referenced only in ORDER BY / GROUP BY is still charged.
query I
SELECT birdshot_authorize('bsess', 'SELECT c1 FROM main.t ORDER BY c3');
----
false

query I
SELECT birdshot_authorize('bsess', 'SELECT count(c1) FROM main.t GROUP BY c3');
----
false

# Allowed columns across SELECT + ORDER BY -> allow.
query I
SELECT birdshot_authorize('bsess', 'SELECT c1 FROM main.t ORDER BY c2');
----
true

# Unconstrained table: every column / star is fine.
query I
SELECT birdshot_authorize('bsess', 'SELECT #1, #2, #3, #4 FROM t2');
----
true

query I
SELECT birdshot_authorize('bsess', 'SELECT * FROM main.t2');
----
true

# Window-only table (no column allow-list): readable in-window via a plain star.
query I
SELECT birdshot_authorize('bsess', 'SELECT * FROM main.win_tbl');
----
true

# ---- walker completeness / fail-closed (adversarial review R1-R8) ------------

# R1: every non-enumerable star variant denies on a column-constrained table.
query I
SELECT birdshot_authorize('bsess', 'SELECT t.* FROM main.t');
----
false

query I
SELECT birdshot_authorize('bsess', 'SELECT x.* FROM main.t x');
----
false

query I
SELECT birdshot_authorize('bsess', 'SELECT COLUMNS(''.*'') FROM main.t');
----
false

query I
SELECT birdshot_authorize('bsess', 'SELECT COLUMNS(''c[34]'') FROM main.t');
----
false

# R1 (no over-deny): COLUMNS(*) over an unconstrained table is fine.
query I
SELECT birdshot_authorize('bsess', 'SELECT COLUMNS(''.*'') FROM main.t2');
----
true

# R2: PIVOT/UNPIVOT source table is gated. secrets is ungranted -> deny.
query I
SELECT birdshot_authorize('bsess', 'SELECT * FROM secrets UNPIVOT(v FOR n IN (c1, c2))');
----
false

# R2 (no over-deny): UNPIVOT over a granted unconstrained table -> allow.
query I
SELECT birdshot_authorize('bsess', 'SELECT * FROM main.t2 UNPIVOT(v FOR n IN (c1, c2))');
----
true

# R3: a scalar subquery hidden in a VALUES cell is gated. secrets -> deny.
query I
SELECT birdshot_authorize('bsess', 'SELECT * FROM (VALUES ((SELECT max(c1) FROM secrets))) AS v(c)');
----
false

# R3 (no over-deny): a plain VALUES list with no base table -> allow.
query I
SELECT birdshot_authorize('bsess', 'SELECT * FROM (VALUES (1), (2)) AS v(c)');
----
true

# R4: WITH RECURSIVE body reads are gated even when the CTE is named after a
# granted table. The recursive body reads secrets -> deny.
query I
SELECT birdshot_authorize('bsess', 'WITH RECURSIVE t2 AS (SELECT c1 FROM secrets UNION SELECT c1 FROM t2) SELECT * FROM t2');
----
false

# R5: a forbidden column in a JOIN ON predicate is charged -> deny.
query I
SELECT birdshot_authorize('bsess', 'SELECT t.c1 FROM main.t t JOIN main.t2 x ON t.c3 = x.c1');
----
false

# R5 (no over-deny): qualified allowed columns across a join -> allow.
query I
SELECT birdshot_authorize('bsess', 'SELECT t.c1 FROM main.t t JOIN main.t2 x ON t.c2 = x.c1');
----
true

# R6: DELETE WHERE referencing an ungranted table via subquery -> deny.
query I
SELECT birdshot_authorize('bsess', 'DELETE FROM main.t2 WHERE c1 IN (SELECT c1 FROM secrets)');
----
false

# R6: UPDATE ... RETURNING a forbidden column on a constrained table -> deny.
query I
SELECT birdshot_authorize('bsess', 'UPDATE main.t SET c1 = 1 RETURNING c3');
----
false

# R7 (fail-closed default does NOT over-deny benign tableless / introspection):
query I
SELECT birdshot_authorize('bsess', 'SELECT 42');
----
true

query I
SELECT birdshot_authorize('bsess', 'SELECT * FROM duckdb_tables()');
----
true

# R8: a forbidden column hidden only inside a LIMIT subquery is charged -> deny.
query I
SELECT birdshot_authorize('bsess', 'SELECT c1 FROM main.t LIMIT (SELECT c3 FROM main.t)');
----
false

# SHOW/DESCRIBE/SUMMARIZE: SUMMARIZE reads all columns of its source and DESCRIBE
# are their own statement classes -> hit the forbidden-statement default (deny),
# so they cannot leak ungranted tables or constrained columns. SHOW (no source
# table) stays allowed for the introspection handshake.
query I
SELECT birdshot_authorize('bsess', 'SUMMARIZE secrets');
----
false

query I
SELECT birdshot_authorize('bsess', 'SUMMARIZE main.t');
----
false

query I
SELECT birdshot_authorize('bsess', 'DESCRIBE secrets');
----
false

query I
SELECT birdshot_authorize('bsess', 'SHOW tables');
----
true

# UNPIVOT IN-list columns are collected (they land in pivot_expressions), so c3/c4
# are charged against the {c1,c2} constraint -> deny.
query I
SELECT birdshot_authorize('bsess', 'SELECT v FROM main.t UNPIVOT(v FOR n IN (c3, c4))');
----
false

# ---- round-2 review fixes (S1-S7) -------------------------------------------

# S1: NATURAL JOIN keys are bind-time invisible -> fail closed on the constrained
# side. (Use SELECT 1 to avoid NATURAL-coalesce qualification quirks.)
query I
SELECT birdshot_authorize('bsess', 'SELECT 1 FROM main.t NATURAL JOIN main.t2');
----
false

# S1 (no over-deny): NATURAL JOIN of two unconstrained granted tables -> allow.
query I
SELECT birdshot_authorize('bsess', 'SELECT 1 FROM main.t2 NATURAL JOIN main.win_tbl');
----
true

# S2: a PIVOT IN-list subquery reading an ungranted table is gated -> deny.
query I
SELECT birdshot_authorize('bsess', 'PIVOT main.t2 ON c1 IN ((SELECT c1 FROM secrets)) USING sum(c2)');
----
false

# S2 (no over-deny): plain IN-list label idents over a granted table -> allow.
query I
SELECT birdshot_authorize('bsess', 'PIVOT main.t2 ON c1 IN (1, 2) USING sum(c2)');
----
true

# S3: a dangerous CAST hidden in an introspection-fn arg is still caught -> deny.
query I
SELECT birdshot_authorize('bsess', 'SELECT * FROM pragma_table_info(CAST(''x'' AS JSON))');
----
false

# S3 (no over-deny): literal-arg / no-arg introspection the handshake needs.
query I
SELECT birdshot_authorize('bsess', 'SELECT * FROM pragma_table_info(''main.t'')');
----
true

query I
SELECT birdshot_authorize('bsess', 'SELECT * FROM duckdb_columns()');
----
true

# S4: per-qualifier stars. A qualified star over a DIFFERENT unconstrained table
# does NOT deny the constrained table; only a bare star or t.* does.
query I
SELECT birdshot_authorize('bsess', 'SELECT x.* FROM main.t t JOIN main.t2 x ON t.c1 = x.c1');
----
true

query I
SELECT birdshot_authorize('bsess', 'SELECT t.* FROM main.t t JOIN main.t2 x ON t.c1 = x.c1');
----
false

query I
SELECT birdshot_authorize('bsess', 'SELECT * FROM main.t t JOIN main.t2 x ON t.c1 = x.c1');
----
false

# S5: a CTE ref is not charged as a phantom ungranted table -> allow.
query I
SELECT birdshot_authorize('bsess', 'WITH cte AS (SELECT c1 FROM main.t2) SELECT * FROM cte');
----
true

# S5: the CTE body's real reads stay charged -> ungranted secrets -> deny.
query I
SELECT birdshot_authorize('bsess', 'WITH cte AS (SELECT s FROM secrets) SELECT * FROM cte');
----
false

# S5 scope isolation: a real ungranted base table sharing a name with a CTE
# declared in a SEPARATE (sibling subquery) scope must still DENY.
query I
SELECT birdshot_authorize('bsess', 'SELECT * FROM (WITH cte AS (SELECT 1) SELECT 1) q, cte');
----
false

# S5 self-shadow (must DENY): a non-recursive CTE cannot reference itself, so the
# body's `FROM t` is the REAL constrained table — its forbidden c3 must be charged.
query I
SELECT birdshot_authorize('bsess', 'WITH t AS (SELECT c3 FROM t) SELECT * FROM t');
----
false

# S5 preceding-sibling scope (must ALLOW): a later CTE may reference an earlier one.
query I
SELECT birdshot_authorize('bsess', 'WITH a AS (SELECT c1 FROM main.t2), b AS (SELECT c1 FROM a) SELECT c1 FROM b');
----
true

# S5 recursive no-over-deny: a RECURSIVE self-ref over a granted unconstrained
# table must still ALLOW (the self-ref is not charged as a phantom table).
query I
SELECT birdshot_authorize('bsess', 'WITH RECURSIVE r AS (SELECT c1 FROM main.t2 UNION SELECT c1 FROM r) SELECT * FROM r');
----
true

# S8 (bind-and-walk): multi-table columns are resolved to their REAL table by the
# binder (each BoundColumnRef carries its own table_index), so a column allowed on
# the constrained table passes and a forbidden one is caught -- no qualifier
# heuristics. Note: a GENUINELY AMBIGUOUS unqualified column across a join (a bare
# name present in BOTH tables, e.g. `SELECT c1 FROM main.t JOIN main.t2`) is INVALID
# SQL -- plain DuckDB throws "Ambiguous reference to column name c1", and so does the
# agent's own DuckDB in production -- so bind-and-walk fails closed (DENY) on it.
# That is correct, so the ALLOW cases below use the well-formed disambiguated forms
# (qualified / USING / single-table-scoped) an agent must actually write.

# ALLOW: an allowed column scoped to the constrained table across a join (the
# `t.c1`/USING forms below also cover the unqualified-resolution intent).
query I
SELECT birdshot_authorize('bsess', 'SELECT main.t.c1 FROM main.t JOIN main.t2 ON main.t.c1 = main.t2.c1');
----
true

# DENY: a forbidden column on the constrained table across a join (c3 in C(main.t),
# not in {c1,c2}).
query I
SELECT birdshot_authorize('bsess', 'SELECT main.t.c3 FROM main.t JOIN main.t2 ON main.t.c1 = main.t2.c1');
----
false

# Control: an unqualified column present in BOTH joined tables is AMBIGUOUS -- the
# binder throws "Ambiguous reference to column name", so bind-and-walk fails closed
# -> DENY. (Plain DuckDB rejects this query too; an agent must qualify it. This is
# at least as strict as the old parse-walk heuristic, which guessed a table.)
query I
SELECT birdshot_authorize('bsess', 'SELECT c1 FROM main.t JOIN main.t2 ON main.t.c1 = main.t2.c1');
----
false

# S8 subsumes S6: USING(allowed) -> allow, USING(forbidden) -> deny.
query I
SELECT birdshot_authorize('bsess', 'SELECT t.c1 FROM main.t t JOIN main.t2 x USING (c1)');
----
true

query I
SELECT birdshot_authorize('bsess', 'SELECT t.c1 FROM main.t t JOIN main.t2 x USING (c3)');
----
false

# WHERE-subquery makes it multi-table; unqualified allowed cols -> allow.
query I
SELECT birdshot_authorize('bsess', 'SELECT c1 FROM main.t WHERE c2 IN (SELECT c1 FROM main.t2)');
----
true

# UNION (multi-table) with allowed unqualified cols -> allow.
query I
SELECT birdshot_authorize('bsess', 'SELECT c1 FROM main.t UNION SELECT c1 FROM main.t2');
----
true

# A qualified column on the UNCONSTRAINED side (c3 is t2's) -> allow.
query I
SELECT birdshot_authorize('bsess', 'SELECT t2.c3 FROM main.t t JOIN main.t2 t2 ON t.c1 = t2.c1');
----
true

# A computed SELECT alias referenced in ORDER BY resolves to no catalog column
# -> not charged -> allow. (Source column qualified to disambiguate across the join;
# the alias `x` itself is not a catalog column.)
query I
SELECT birdshot_authorize('bsess', 'SELECT main.t.c1 + 1 AS x FROM main.t JOIN main.t2 ON main.t.c1 = main.t2.c1 ORDER BY x');
----
true

# Schema-qualified ref to the constrained table: GetTableName() returns the table
# component (`t`), so a forbidden schema-qualified col is still caught -> deny.
query I
SELECT birdshot_authorize('bsess', 'SELECT main.t.c3 FROM main.t JOIN main.t2 ON main.t.c1 = main.t2.c1');
----
false

# ...and the allowed schema-qualified analog -> allow.
query I
SELECT birdshot_authorize('bsess', 'SELECT main.t.c1 FROM main.t JOIN main.t2 ON main.t.c1 = main.t2.c1');
----
true

# Generated columns -> INFORMATION-FLOW semantics (bind-and-walk's natural model,
# user decision). The binder replaces a generated column with its generation
# expression, so bind-and-walk sees the SOURCE columns it reads, not the generated
# name. `c5` (= c1 + 1) derives ONLY from the allowed column c1, so reading c5
# reads only allowed data -> ALLOW. (`c5` is unambiguous: it exists only on main.t.)
# This is sound: a generated column is allowed iff all its source columns are
# allowed; no forbidden data can leak through it. The forbidden-source control
# (a generated column derived from c3) is in the bind-and-walk regression section.
query I
SELECT birdshot_authorize('bsess', 'SELECT c5 FROM main.t JOIN main.t2 ON main.t.c1 = main.t2.c1');
----
true

# S7: whoami() is allow-listed as quack node-identity introspection -> allow.
query I
SELECT birdshot_authorize('bsess', 'SELECT * FROM whoami()');
----
true

# ============================================================================
# bind-and-walk regression suite
#
# These pin the bind-and-walk extraction (which supersedes the parse-walk's
# table/column extraction). All run on the `bsess` session (user bob, role
# colrole): main.t read+write, columns restricted to {c1,c2}; main.t2 read+write,
# unconstrained. lake_catalog = 'memory'.
# ============================================================================

# ---- regression-suite fixtures + config -------------------------------------
# birdshot_commit_config() REPLACES the live snapshot with staging (it does not
# merge), exactly like the gateway's applySnapshot. So this section creates ALL
# its tables, then RE-STAGES the complete colrole config (the original grants +
# the regression-table grants/constraints) and commits ONCE. The `bsess` session
# (authenticated earlier) survives — sessions are kept separately from the
# swappable policy snapshot.

statement ok
CREATE TABLE main.st(c1 INT, c2 INT, c3 STRUCT(f INT, g INT), c4 STRUCT(mid STRUCT(deeper INT)));

statement ok
CREATE TABLE main.gt(c1 INT, c2 INT, c3 INT, g_ok INT GENERATED ALWAYS AS (c1 + 1), g_bad INT GENERATED ALWAYS AS (c3 + 1));

statement ok
CREATE TABLE main.ungranted(c1 INT);

# Re-stage the FULL colrole policy (original + regression tables) and commit once.
statement ok
SELECT birdshot_set_auth('', '', 'dev');

statement ok
SELECT birdshot_set_lake_catalog('memory');

statement ok
SELECT birdshot_add_role_grant('colrole', 'main.t', 'read');

statement ok
SELECT birdshot_add_role_grant('colrole', 'main.t', 'write');

statement ok
SELECT birdshot_add_role_grant('colrole', 'main.t2', 'read');

statement ok
SELECT birdshot_add_role_grant('colrole', 'main.t2', 'write');

statement ok
SELECT birdshot_add_role_grant('colrole', 'main.st', 'read');

statement ok
SELECT birdshot_add_role_grant('colrole', 'main.gt', 'read');

statement ok
SELECT birdshot_add_grant_constraint('colrole', 'main.t', 'c1,c2', '', '');

statement ok
SELECT birdshot_add_grant_constraint('colrole', 'main.st', 'c1', '', '');

statement ok
SELECT birdshot_add_grant_constraint('colrole', 'main.gt', 'c1,c2', '', '');

statement ok
SELECT birdshot_add_user_role('bob', 'colrole');

statement ok
SELECT birdshot_commit_config();

# ---- BS-STRUCT-1: dotted struct/nested-field access via bind-walk -----------
# The binder wraps a struct field access in struct_extract over a BoundColumnRef
# to the BASE column, so the field name is never a column ref and the base column
# is charged exactly. main.st is constrained to {c1}: a forbidden base column (c3)
# is caught; the allowed c1 passes; field idents (`f`,`g`,`deeper`) never leak.

# DENY: unparenthesized dotted access to a forbidden struct base column c3.
query I
SELECT birdshot_authorize('bsess', 'SELECT c3.f FROM main.st');
----
false

# DENY: qualified dotted access (alias) to forbidden c3.
query I
SELECT birdshot_authorize('bsess', 'SELECT s.c3.f FROM main.st s');
----
false

# DENY: deeply-nested forbidden struct base (c4 not in {c1}).
query I
SELECT birdshot_authorize('bsess', 'SELECT c4.mid.deeper FROM main.st');
----
false

# DENY: forbidden struct base read in WHERE.
query I
SELECT birdshot_authorize('bsess', 'SELECT c1 FROM main.st WHERE c3.g > 0');
----
false

# ALLOW: allowed base column; whole struct never touched.
query I
SELECT birdshot_authorize('bsess', 'SELECT c1 FROM main.st');
----
true

# ---- generated columns: information-flow model ------------------------------
# A generated column is replaced by its generation expr at bind, so bind-walk
# charges its SOURCE columns. Allowed-source -> allow; forbidden-source -> deny.
# (main.gt is created + granted + constrained to {c1,c2} in the fixtures above.)

# ALLOW: g_ok = c1 + 1 reads only the allowed column c1.
query I
SELECT birdshot_authorize('bsess', 'SELECT g_ok FROM main.gt');
----
true

# DENY: g_bad = c3 + 1 reads the forbidden column c3 (info-flow catch).
query I
SELECT birdshot_authorize('bsess', 'SELECT g_bad FROM main.gt');
----
false

# DENY control: direct forbidden c3.
query I
SELECT birdshot_authorize('bsess', 'SELECT c3 FROM main.gt');
----
false

# ---- WRITES / DDL: target table charged as a write -------------------------
# INSERT/UPDATE/DELETE bind to LogicalInsert/Update/Delete with the target table;
# CTAS to LogicalCreateTable. Each is charged as a write TableUse.

# INSERT into a write-granted table (well-formed arity) -> allow.
query I
SELECT birdshot_authorize('bsess', 'INSERT INTO main.t2 VALUES (1, 2, 3, 4)');
----
true

# INSERT into a table with NO write grant (main.st is read-only) -> deny.
query I
SELECT birdshot_authorize('bsess', 'INSERT INTO main.st VALUES (1, 2, NULL, NULL)');
----
false

# UPDATE a write-granted table -> allow.
query I
SELECT birdshot_authorize('bsess', 'UPDATE main.t2 SET c1 = 1 WHERE c2 = 2');
----
true

# DELETE on a write-granted table -> allow.
query I
SELECT birdshot_authorize('bsess', 'DELETE FROM main.t2 WHERE c1 = 1');
----
true

# DELETE on a table with no write grant (main.st) -> deny.
query I
SELECT birdshot_authorize('bsess', 'DELETE FROM main.st WHERE c1 = 1');
----
false

# CTAS (CREATE TABLE ... AS) is a CREATE/DDL statement class -> denied by the
# parse-walk PRE-FILTER (Layer 1) before bind-walk runs, same as any CREATE. DDL
# is never allowed on the agent path. (bind-walk's LogicalCreateTable handler is
# defensive: it would charge the new table as a write target if a future pre-filter
# ever admitted CTAS, but today CTAS never reaches Layer 2.)
query I
SELECT birdshot_authorize('bsess', 'CREATE TABLE main.t2 AS SELECT c1 FROM main.t2');
----
false

# UPDATE writing a forbidden column on a column-constrained table -> deny
# (column allow-lists are not action-scoped; c3 not in {c1,c2}).
query I
SELECT birdshot_authorize('bsess', 'UPDATE main.t SET c3 = 1 WHERE c1 = 0');
----
false

# ---- multi-statement batch: every statement is bound + walked ---------------
# A forbidden/ungranted read hidden after a benign statement denies the batch.
# (main.ungranted is created in the fixtures above; it has no grant.)

# A batch whose 2nd statement reads an ungranted table -> deny.
query I
SELECT birdshot_authorize('bsess', 'SELECT c1 FROM main.t2; SELECT c1 FROM main.ungranted');
----
false

# A batch of two granted reads -> allow.
query I
SELECT birdshot_authorize('bsess', 'SELECT c1 FROM main.t2; SELECT c1 FROM main.t');
----
true

# A batch whose 2nd statement reads a forbidden column on a constrained table -> deny.
query I
SELECT birdshot_authorize('bsess', 'SELECT c1 FROM main.t; SELECT c3 FROM main.t');
----
false

# ---- Q3: bare (unqualified) table resolves against the lake catalog ---------
# Form-A push-down sends `FROM <bare>` on a connection where USE lake did not
# carry. lake_catalog='memory' (the default here), so a bare ref resolves and the
# column constraint still applies.

# Bare table, allowed columns -> allow.
query I
SELECT birdshot_authorize('bsess', 'SELECT c1, c2 FROM t');
----
true

# Bare table, forbidden column -> deny.
query I
SELECT birdshot_authorize('bsess', 'SELECT c3 FROM t');
----
false

# Bare positional refs (#N, form-A) resolve to catalog ordinals -> c1,c2 allow.
query I
SELECT birdshot_authorize('bsess', 'SELECT #1, #2 FROM t');
----
true

# Bare positional ref to a forbidden ordinal (#3 = c3) -> deny.
query I
SELECT birdshot_authorize('bsess', 'SELECT #3 FROM t');
----
false

# ---- read_csv is blocked at the pre-filter (file/dynamic reader denylist) ----
# (enable_external_access=false is a Phase-3 gateway boot setting; the parse-walk
# pre-filter denies read_csv regardless, so this holds in-harness too.)
query I
SELECT birdshot_authorize('bsess', 'SELECT * FROM read_csv(''/etc/passwd'')');
----
false

# ============================================================================
# Full-scope capability ACL (Phase 2): CREATE/DROP/ALTER catalog DDL + read_source/
# copy_to/attach/install POLICY-gated resources, all authorized at the PARSE layer.
# A fresh config grants a 'power' role the new capabilities so the ALLOW paths are
# reachable (the suite above proves every new class still DENIES with no grant).
# ============================================================================

query I
SELECT birdshot_reset_config();
----
ok

query I
SELECT birdshot_set_auth('', '', 'dev');
----
ok

# Catalog DDL capabilities: create in schema hn, create the hn2 schema, drop main.todos,
# read main.todos (for a CTAS-from-catalog source).
query I
SELECT birdshot_add_role_grant('power', 'hn.*', 'create');
----
ok

query I
SELECT birdshot_add_role_grant('power', 'hn2', 'create');
----
ok

query I
SELECT birdshot_add_role_grant('power', 'main.todos', 'drop');
----
ok

query I
SELECT birdshot_add_role_grant('power', 'main.todos', 'read');
----
ok

# Non-catalog resource policies (default-deny: only listed resources pass).
query I
SELECT birdshot_add_source_policy('power', 'data.example.com');
----
ok

query I
SELECT birdshot_add_ext_policy('power', 'birdshot');
----
ok

query I
SELECT birdshot_add_attach_policy('power', 'lake.example.com');
----
ok

query I
SELECT birdshot_add_user_role('pat', 'power');
----
ok

query I
SELECT birdshot_add_service_token('pow-token', 'pat');
----
ok

query I
SELECT birdshot_commit_config();
----
ok

query I
SELECT birdshot_authenticate('psess', 'pow-token', '');
----
true

# ---- CREATE (catalog DDL, capability-gated) --------------------------------

# CREATE TABLE in a granted schema (create on hn.*) -> allow.
query I
SELECT birdshot_authorize('psess', 'CREATE TABLE hn.newt(id INT, title VARCHAR)');
----
true

# CREATE TABLE in an UNGRANTED schema -> deny (no create on other.*).
query I
SELECT birdshot_authorize('psess', 'CREATE TABLE other.newt(id INT)');
----
false

# CREATE SCHEMA with an exact create grant on that schema name -> allow.
query I
SELECT birdshot_authorize('psess', 'CREATE SCHEMA hn2');
----
true

# CREATE SCHEMA without a matching grant -> deny.
query I
SELECT birdshot_authorize('psess', 'CREATE SCHEMA other2');
----
false

# CREATE VIEW in a granted schema -> allow (create on hn.*).
query I
SELECT birdshot_authorize('psess', 'CREATE VIEW hn.v AS SELECT 1');
----
true

# CREATE VIEW in an ungranted schema -> deny.
query I
SELECT birdshot_authorize('psess', 'CREATE VIEW other.v AS SELECT 1');
----
false

# CREATE INDEX (resource model deferred to Phase 3) -> deny (fail closed).
query I
SELECT birdshot_authorize('psess', 'CREATE INDEX i ON hn.newt(id)');
----
false

# ---- DROP / ALTER (catalog DDL) --------------------------------------------

# DROP a table with a drop grant -> allow.
query I
SELECT birdshot_authorize('psess', 'DROP TABLE main.todos');
----
true

# DROP an ungranted table -> deny (read/create grants do NOT cover drop).
query I
SELECT birdshot_authorize('psess', 'DROP TABLE secrets');
----
false

# ALTER an ungranted table -> deny (no alter grant anywhere).
query I
SELECT birdshot_authorize('psess', 'ALTER TABLE main.todos RENAME TO t9');
----
false

# ---- read_source (policy-gated FROM-clause table function) -----------------

# read_csv over an ALLOWLISTED https host -> allow (source policy data.example.com).
query I
SELECT birdshot_authorize('psess', 'SELECT * FROM read_csv(''https://data.example.com/x.csv'')');
----
true

# read_csv over a NON-allowlisted host -> deny (policy:read_source).
query I
SELECT birdshot_authorize('psess', 'SELECT * FROM read_csv(''https://evil.example/x.csv'')');
----
false

# read_csv with a NON-CONSTANT source arg -> deny (can't pin the URI under live
# egress; the SSRF/exfil guard fails closed).
query I
SELECT birdshot_authorize('psess', 'SELECT * FROM read_csv(concat(''https://data.example.com/'', ''x.csv''))');
----
false

# bare file path (no https/quack scheme, no exact policy entry) -> deny.
query I
SELECT birdshot_authorize('psess', 'SELECT * FROM read_csv(''/etc/passwd'')');
----
false

# ---- in-session ETL: CTAS = create + read_source in one governed statement -

# CTAS into a granted schema FROM an allowlisted source -> allow (the ETL path).
query I
SELECT birdshot_authorize('psess', 'CREATE TABLE hn.stories AS SELECT * FROM read_csv(''https://data.example.com/hn.csv'')');
----
true

# CTAS with a granted create target but a NON-allowlisted source -> deny.
query I
SELECT birdshot_authorize('psess', 'CREATE TABLE hn.stories AS SELECT * FROM read_csv(''https://evil.example/hn.csv'')');
----
false

# CTAS into an UNGRANTED schema even from an allowlisted source -> deny (create gate).
query I
SELECT birdshot_authorize('psess', 'CREATE TABLE other.x AS SELECT * FROM read_csv(''https://data.example.com/x.csv'')');
----
false

# CTAS from a catalog table the user may READ -> allow (create hn.* + read main.todos).
query I
SELECT birdshot_authorize('psess', 'CREATE TABLE hn.copy AS SELECT id, title FROM main.todos');
----
true

# ---- install / attach (policy-gated) ---------------------------------------

# INSTALL an allowlisted extension -> allow (ext policy 'birdshot').
query I
SELECT birdshot_authorize('psess', 'INSTALL birdshot');
----
true

# INSTALL a non-allowlisted extension -> deny.
query I
SELECT birdshot_authorize('psess', 'INSTALL httpfs');
----
false

# ATTACH an allowlisted https target -> allow (attach policy lake.example.com).
query I
SELECT birdshot_authorize('psess', 'ATTACH ''https://lake.example.com/db'' AS l');
----
true

# ATTACH a bare local path -> deny (no exact policy entry; file paths default-deny).
query I
SELECT birdshot_authorize('psess', 'ATTACH ''evil.db'' AS x');
----
false

# PRAGMA / SET stay deny-by-default (not made grantable in this phase).
query I
SELECT birdshot_authorize('psess', 'PRAGMA enable_profiling');
----
false

# ============================================================================
# Column constraints on the PARSE-AUTHORIZED path. When a statement carries a
# read_source (or DDL), authorization is parse-level and the bind-walk is skipped,
# so column allow-lists are enforced by EnforceConstraints over the parse-walk's
# own column collection. A column-constrained read joined to a read_source must
# still deny a forbidden column (this is the branch the unconstrained 'pat' tests
# above never reach). NOTE (Phase 3): before column constraints and source/DDL
# grants are emitted together in prod, catalog-table reads on this path should be
# routed back through the bind-walk for struct/star/positional precision.
# ============================================================================

query I
SELECT birdshot_reset_config();
----
ok

query I
SELECT birdshot_set_auth('', '', 'dev');
----
ok

query I
SELECT birdshot_add_role_grant('colp', 'main.todos', 'read');
----
ok

# Column allow-list: only `id` is readable on main.todos.
query I
SELECT birdshot_add_grant_constraint('colp', 'main.todos', 'id', NULL, NULL);
----
ok

query I
SELECT birdshot_add_source_policy('colp', 'allowed.example');
----
ok

query I
SELECT birdshot_add_user_role('colu', 'colp');
----
ok

query I
SELECT birdshot_add_service_token('col-token', 'colu');
----
ok

query I
SELECT birdshot_commit_config();
----
ok

query I
SELECT birdshot_authenticate('csess', 'col-token', '');
----
true

# Allowed column read joined to an allowlisted read_source -> allow.
query I
SELECT birdshot_authorize('csess', 'SELECT id FROM main.todos, read_csv(''https://allowed.example/x.csv'')');
----
true

# FORBIDDEN column (title not in {id}) on the parse-authorized path -> deny.
# (Proves column constraints are enforced even when the bind-walk is skipped.)
query I
SELECT birdshot_authorize('csess', 'SELECT title FROM main.todos, read_csv(''https://allowed.example/x.csv'')');
----
false

# ============================================================================
# STAGE A: DML split + object-kind discriminator + IsProtectedRef + grant store
# (spec §1/§2). A fresh config so the ALLOW paths are reachable; the suite above
# already proves every class DENIES with no grant.
# ============================================================================

# ---- fixtures ---------------------------------------------------------------

statement ok
CREATE TABLE main.dt(c1 INT, c2 INT);

statement ok
CREATE SEQUENCE main.sq;

statement ok
CREATE TABLE main.tb(c1 INT);

# The protected grant-store table fixture. Created directly by the harness (NOT via
# birdshot). No token may ever address it, even with a wildcard grant (see below).
statement ok
CREATE TABLE __birdshot_grants(k VARCHAR, v VARCHAR);

# ---- fresh config: split-DML + kind-aware + wildcard roles ------------------

query I
SELECT birdshot_reset_config();
----
ok

query I
SELECT birdshot_set_auth('', '', 'dev');
----
ok

query I
SELECT birdshot_set_lake_catalog('memory');
----
ok

# wonly: legacy WRITE umbrella on main.dt (must cover all split DML + read).
query I
SELECT birdshot_add_role_grant('wonly', 'main.dt', 'write');
----
ok

# ionly: INSERT only (fine-grained) on main.dt.
query I
SELECT birdshot_add_role_grant('ionly', 'main.dt', 'insert');
----
ok

# uonly: UPDATE only, NO read — proves the LOCKED "UPDATE...WHERE needs read too".
query I
SELECT birdshot_add_role_grant('uonly', 'main.dt', 'update');
----
ok

# fine: the four fine-grained DML caps + read on main.dt (realistic full-DML role).
query I
SELECT birdshot_add_role_grant('fine', 'main.dt', 'read');
----
ok

query I
SELECT birdshot_add_role_grant('fine', 'main.dt', 'insert');
----
ok

query I
SELECT birdshot_add_role_grant('fine', 'main.dt', 'update');
----
ok

query I
SELECT birdshot_add_role_grant('fine', 'main.dt', 'delete');
----
ok

# ronly: read only on main.dt.
query I
SELECT birdshot_add_role_grant('ronly', 'main.dt', 'read');
----
ok

# kind role: drop on main.sq as a SEQUENCE, drop on main.tb as a TABLE (default),
# create on the cs.* schema wildcard, a WILDCARD read (for the protected-ref test),
# and a table-kind drop on the protected store table.
query I
SELECT birdshot_add_role_grant_kind('kr', 'main.sq', 'drop', 'sequence');
----
ok

query I
SELECT birdshot_add_role_grant('kr', 'main.tb', 'drop');
----
ok

query I
SELECT birdshot_add_role_grant('kr', 'cs.*', 'create');
----
ok

query I
SELECT birdshot_add_role_grant('kr', '*', 'read');
----
ok

query I
SELECT birdshot_add_role_grant('kr', '__birdshot_grants', 'drop');
----
ok

# users + tokens + sessions
query I
SELECT birdshot_add_user_role('wu', 'wonly');
----
ok

query I
SELECT birdshot_add_user_role('iu', 'ionly');
----
ok

query I
SELECT birdshot_add_user_role('uu', 'uonly');
----
ok

query I
SELECT birdshot_add_user_role('fu', 'fine');
----
ok

query I
SELECT birdshot_add_user_role('ru', 'ronly');
----
ok

query I
SELECT birdshot_add_user_role('ku', 'kr');
----
ok

query I
SELECT birdshot_add_service_token('wtok', 'wu');
----
ok

query I
SELECT birdshot_add_service_token('itok', 'iu');
----
ok

query I
SELECT birdshot_add_service_token('utok', 'uu');
----
ok

query I
SELECT birdshot_add_service_token('ftok', 'fu');
----
ok

query I
SELECT birdshot_add_service_token('rtok', 'ru');
----
ok

query I
SELECT birdshot_add_service_token('ktok', 'ku');
----
ok

query I
SELECT birdshot_commit_config();
----
ok

query I
SELECT birdshot_authenticate('wsess', 'wtok', '');
----
true

query I
SELECT birdshot_authenticate('isess', 'itok', '');
----
true

query I
SELECT birdshot_authenticate('usess', 'utok', '');
----
true

query I
SELECT birdshot_authenticate('fsess', 'ftok', '');
----
true

query I
SELECT birdshot_authenticate('rsess', 'rtok', '');
----
true

query I
SELECT birdshot_authenticate('ksess', 'ktok', '');
----
true

# ---- WRITE umbrella back-compat: a legacy `write` grant still covers ALL DML ----

query I
SELECT birdshot_authorize('wsess', 'SELECT c1 FROM main.dt');
----
true

query I
SELECT birdshot_authorize('wsess', 'INSERT INTO main.dt VALUES (1, 2)');
----
true

query I
SELECT birdshot_authorize('wsess', 'UPDATE main.dt SET c1 = 1 WHERE c2 = 2');
----
true

query I
SELECT birdshot_authorize('wsess', 'DELETE FROM main.dt WHERE c1 = 1');
----
true

# TRUNCATE maps to DELETE (v1.5.3: parses to an unconditioned DeleteStatement).
# The WRITE umbrella covers DELETE + READ, so TRUNCATE is allowed here.
query I
SELECT birdshot_authorize('wsess', 'TRUNCATE main.dt');
----
true

# ---- split DML: an INSERT-only grant allows INSERT, denies the rest ---------

query I
SELECT birdshot_authorize('isess', 'INSERT INTO main.dt VALUES (1, 2)');
----
true

# INSERT-only cannot SELECT.
query I
SELECT birdshot_authorize('isess', 'SELECT c1 FROM main.dt');
----
false

# INSERT-only cannot UPDATE (fine-grained caps cover only themselves).
query I
SELECT birdshot_authorize('isess', 'UPDATE main.dt SET c1 = 1 WHERE c2 = 2');
----
false

# INSERT-only cannot DELETE.
query I
SELECT birdshot_authorize('isess', 'DELETE FROM main.dt WHERE c1 = 1');
----
false

# INSERT ... SELECT FROM self needs {INSERT, READ}; read is missing -> deny.
query I
SELECT birdshot_authorize('isess', 'INSERT INTO main.dt SELECT c1, c2 FROM main.dt');
----
false

# ---- LOCKED: UPDATE/DELETE do NOT imply READ -------------------------------
# uonly holds UPDATE but not READ; UPDATE...WHERE requires BOTH -> deny.

query I
SELECT birdshot_authorize('usess', 'UPDATE main.dt SET c1 = 1 WHERE c2 = 2');
----
false

# ---- fine-grained full-DML role: each cap works on its own action ----------

query I
SELECT birdshot_authorize('fsess', 'INSERT INTO main.dt VALUES (1, 2)');
----
true

query I
SELECT birdshot_authorize('fsess', 'UPDATE main.dt SET c1 = 1 WHERE c2 = 2');
----
true

query I
SELECT birdshot_authorize('fsess', 'DELETE FROM main.dt WHERE c1 = 1');
----
true

query I
SELECT birdshot_authorize('fsess', 'SELECT c1 FROM main.dt');
----
true

# ---- read-only role: SELECT allowed, writes + TRUNCATE denied --------------

query I
SELECT birdshot_authorize('rsess', 'SELECT c1 FROM main.dt');
----
true

query I
SELECT birdshot_authorize('rsess', 'INSERT INTO main.dt VALUES (1, 2)');
----
false

# TRUNCATE (maps to DELETE, which also scans -> needs DELETE+READ); read-only -> deny.
query I
SELECT birdshot_authorize('rsess', 'TRUNCATE main.dt');
----
false

# ---- object-kind separation (DROP): a table-kind drop grant never satisfies a
# sequence DROP, and vice versa (spec §1c). ----------------------------------

# sequence-kind drop grant on main.sq satisfies DROP SEQUENCE main.sq -> allow.
query I
SELECT birdshot_authorize('ksess', 'DROP SEQUENCE main.sq');
----
true

# ...but NOT a table DROP of the same name (only a sequence-kind grant exists) -> deny.
query I
SELECT birdshot_authorize('ksess', 'DROP TABLE main.sq');
----
false

# table-kind drop grant on main.tb satisfies DROP TABLE main.tb -> allow.
query I
SELECT birdshot_authorize('ksess', 'DROP TABLE main.tb');
----
true

# ...but NOT a sequence DROP of the same name (only a table-kind grant exists) -> deny.
query I
SELECT birdshot_authorize('ksess', 'DROP SEQUENCE main.tb');
----
false

# back-compat (advisor R): TABLE and VIEW are ONE relation class (spec §8a), so the
# legacy table-kind drop grant on main.tb ALSO covers DROP VIEW main.tb. Without the
# TABLE≡VIEW rule in KindMatch this would wrongly deny — a silent regression, since
# every legacy drop/alter grant is table-kind but `DROP VIEW` now carries VIEW kind.
query I
SELECT birdshot_authorize('ksess', 'DROP VIEW main.tb');
----
true

# ...and the separation still holds the other way: main.sq has ONLY a sequence-kind
# drop grant, so DROP VIEW main.sq (VIEW use) is NOT covered -> deny. TABLE≡VIEW does
# not leak into the SEQUENCE class.
query I
SELECT birdshot_authorize('ksess', 'DROP VIEW main.sq');
----
false

# ---- CREATE object types: SEQUENCE / TYPE / MACRO now emit a CREATE cap_use.
# CREATE is schema-scoped (kind TABLE), so the cs.* create grant covers every kind. -

query I
SELECT birdshot_authorize('ksess', 'CREATE SEQUENCE cs.s1');
----
true

query I
SELECT birdshot_authorize('ksess', 'CREATE TYPE cs.ty AS ENUM (''a'', ''b'')');
----
true

query I
SELECT birdshot_authorize('ksess', 'CREATE MACRO cs.m() AS 1');
----
true

# CREATE SEQUENCE in an UNGRANTED schema -> deny.
query I
SELECT birdshot_authorize('ksess', 'CREATE SEQUENCE other.s1');
----
false

# CREATE INDEX stays fail-closed (resource model deferred) -> deny.
query I
SELECT birdshot_authorize('ksess', 'CREATE INDEX ix ON main.tb(c1)');
----
false

# ---- IsProtectedRef: the grant store is unaddressable in BOTH planes --------
# ku holds a WILDCARD read grant (`*`) that RefMatches everything, yet the store
# table is DENIED anyway — protection overrides any grant, for every token.

# bind-walk plane: SELECT of the protected table -> deny (despite wildcard read).
query I
SELECT birdshot_authorize('ksess', 'SELECT * FROM __birdshot_grants');
----
false

# parse-walk plane: DROP of the protected table -> deny (despite the drop grant).
query I
SELECT birdshot_authorize('ksess', 'DROP TABLE __birdshot_grants');
----
false

# DML plane: INSERT into the protected table -> deny.
query I
SELECT birdshot_authorize('ksess', 'INSERT INTO __birdshot_grants VALUES (''x'', ''y'')');
----
false

# ---- Stage B: birdshot_set_grant_store config function ----------------------

# default / explicit memory backend.
query I
SELECT birdshot_set_grant_store('memory', '');
----
memory

# table backend selects the 'table' kind and reserves the protected store catalog.
query I
SELECT birdshot_set_grant_store('table', ':memory:');
----
table

# unknown kind falls back to memory (fail-closed: never half-enable a store).
query I
SELECT birdshot_set_grant_store('bogus', 'x');
----
memory

# a token can NEVER invoke the store config over the wire (birdshot_* denylist).
query I
SELECT birdshot_authorize('ksess', 'SELECT birdshot_set_grant_store(''table'', ''x'')');
----
false

# ==========================================================================
# Native GRANT / REVOKE statement (ParserExtension authoring surface)
# ==========================================================================
#
# `GRANT …` / `REVOKE …` execute as real SQL (no birdshot_* call) and mutate the
# LIVE grant store immediately (direct-to-live, no staging/commit). Self-contained
# config block (appended last so no later commit clobbers these direct-live grants).

query I
SELECT birdshot_reset_config();
----
ok

query I
SELECT birdshot_set_auth('', '', 'dev');
----
ok

query I
SELECT birdshot_add_service_token('gsvc', 'grantee1');
----
ok

# A subject whose id EQUALS an admin role name ("collide"), for the namespace
# isolation test at the end. Committed here (service tokens are staged); the
# collision GRANTs are direct-to-live later so this commit can't clobber them.
query I
SELECT birdshot_add_service_token('collide-tok', 'collide');
----
ok

# A subject with NO explicit roles/grants ("norole"), for the PUBLIC test: a GRANT
# TO PUBLIC must reach it even though it holds nothing. Committed here for the same
# reason (later PUBLIC grants are direct-to-live).
query I
SELECT birdshot_add_service_token('norole-tok', 'norole');
----
ok

query I
SELECT birdshot_commit_config();
----
ok

statement ok
CREATE TABLE main.gtab(id INT, title VARCHAR);

statement ok
CREATE TABLE main.gall(id INT, title VARCHAR);

statement ok
CREATE TABLE main.grole(id INT, title VARCHAR);

query I
SELECT birdshot_authenticate('gsess', 'gsvc', '');
----
true

# ---- GRANT then REVOKE a table privilege (enforcement reflects each) ---------

# Before any grant: default-deny.
query I
SELECT birdshot_authorize('gsess', 'SELECT * FROM main.gtab');
----
false

# Native GRANT executes and emits a status row.
query I
GRANT SELECT ON main.gtab TO grantee1;
----
GRANT

# Grant took effect immediately -> allow.
query I
SELECT birdshot_authorize('gsess', 'SELECT * FROM main.gtab');
----
true

# Native REVOKE removes the exact grant -> back to deny.
query I
REVOKE SELECT ON main.gtab FROM grantee1;
----
REVOKE

query I
SELECT birdshot_authorize('gsess', 'SELECT * FROM main.gtab');
----
false

# ---- ALL PRIVILEGES expands to the object class's full cap set ---------------

query I
GRANT ALL PRIVILEGES ON main.gall TO grantee1;
----
GRANT

# SELECT (read) covered.
query I
SELECT birdshot_authorize('gsess', 'SELECT * FROM main.gall');
----
true

# INSERT (insert) covered by the same ALL PRIVILEGES grant.
query I
SELECT birdshot_authorize('gsess', 'INSERT INTO main.gall VALUES (1, ''x'')');
----
true

# ---- role membership (GRANT <role> TO <subject>) + TO ROLE -------------------

# Grant SELECT to a NAMED role (grantee1 is not a member yet).
query I
GRANT SELECT ON main.grole TO ROLE greaders;
----
GRANT

query I
SELECT birdshot_authorize('gsess', 'SELECT * FROM main.grole');
----
false

# Add grantee1 to the role -> now covered.
query I
GRANT greaders TO grantee1;
----
GRANT

query I
SELECT birdshot_authorize('gsess', 'SELECT * FROM main.grole');
----
true

# Revoke the membership -> deny again.
query I
REVOKE greaders FROM grantee1;
----
REVOKE

query I
SELECT birdshot_authorize('gsess', 'SELECT * FROM main.grole');
----
false

# ---- THE WIRE-DENY SECURITY TEST (mandatory) --------------------------------
#
# An authenticated non-admin session must NEVER be able to grant itself access by
# submitting a GRANT over the authorize path. The parse-walk pre-filter denies the
# EXTENSION_STATEMENT / GRANT-shaped SQL fail-closed BEFORE any bind/plan/execution.

# gtab is currently NOT granted to grantee1 (revoked above). A wire GRANT is denied…
query I
SELECT birdshot_authorize('gsess', 'GRANT SELECT ON main.gtab TO grantee1');
----
false

# …AND it did not take effect: the subsequent SELECT is still denied.
query I
SELECT birdshot_authorize('gsess', 'SELECT * FROM main.gtab');
----
false

# Wire REVOKE is denied too (same gate).
query I
SELECT birdshot_authorize('gsess', 'REVOKE ALL PRIVILEGES ON main.gall FROM grantee1');
----
false

# The wire REVOKE was ineffective: grantee1 still holds ALL PRIVILEGES on gall.
query I
SELECT birdshot_authorize('gsess', 'SELECT * FROM main.gall');
----
true

# ---- fail-closed parse errors (unknown / unenforced privilege; deferred) -----

# Unenforced PG privilege -> hard error (never a silent drop).
statement error
GRANT TRIGGER ON main.gtab TO grantee1;
----
unknown or unenforced privilege

# Typo'd privilege -> hard error.
statement error
GRANT SELCT ON main.gtab TO grantee1;
----
unknown or unenforced privilege

# Empty column list -> clear error (never a silent drop).
statement error
GRANT SELECT () ON main.gtab TO grantee1;
----
empty column list

# CURRENT_USER is an HONEST BLOCKER on this path (no caller identity available);
# the error states the reason (not a generic "unsupported").
statement error
GRANT SELECT ON main.gtab TO CURRENT_USER;
----
needs a caller identity

# REVOKE GRANT OPTION FOR needs the Phase 3b delegation graph -> clear error.
statement error
REVOKE GRANT OPTION FOR SELECT ON main.gtab FROM grantee1;
----
not supported yet

# A column list on a non-relation object is rejected.
statement error
GRANT USAGE (x) ON SEQUENCE main.gseq TO grantee1;
----
column lists apply only to TABLE/VIEW

# Malformed (no grantee) -> error.
statement error
GRANT SELECT ON main.gtab TO;
----
birdshot GRANT

# ---- multi-grantee (TO a, ROLE r) in one statement --------------------------

statement ok
CREATE TABLE main.gmulti(id INT);

# One GRANT to a subject AND a named role at once.
query I
GRANT SELECT ON main.gmulti TO grantee1, ROLE gmrole;
----
GRANT

# The subject grantee (grantee1) is covered.
query I
SELECT birdshot_authorize('gsess', 'SELECT * FROM main.gmulti');
----
true

# ---- subject/role namespace isolation (advisor Finding A) --------------------
# A subject id that happens to equal an admin ROLE name must NOT inherit that
# role's grants. `TO <subject>` stores the grant under a namespaced self-role, so
# subject "collide" and role "collide" live in disjoint keyspaces. Before the fix
# this leaked the role's grant to the subject (privilege escalation).

statement ok
CREATE TABLE main.gsensitive(id INT);

statement ok
CREATE TABLE main.gbenign(id INT);

# Admin grants a SENSITIVE privilege to the ROLE named "collide".
query I
GRANT SELECT ON main.gsensitive TO ROLE collide;
----
GRANT

# A BENIGN privilege is granted to the SUBJECT "collide" (same string as the role).
query I
GRANT SELECT ON main.gbenign TO collide;
----
GRANT

# Authenticate a session for user "collide" (token committed in the setup block).
query I
SELECT birdshot_authenticate('csess', 'collide-tok', '');
----
true

# The subject gets its OWN direct grant (gbenign) -> allow.
query I
SELECT birdshot_authorize('csess', 'SELECT * FROM main.gbenign');
----
true

# But it must NOT inherit ROLE "collide"'s grant (gsensitive) -> deny.
# (Pre-fix this returned true = escalation.)
query I
SELECT birdshot_authorize('csess', 'SELECT * FROM main.gsensitive');
----
false

# ==========================================================================
# Native GRANT / REVOKE — Phase 3a deferred constructs, now BUILT
# ==========================================================================

# ---- Tier 1: COLUMN LISTS (GrantConstraint allow-list) ----------------------
# `GRANT SELECT (c1,c2) ON t` = a read grant on t PLUS a column allow-list {c1,c2}
# enforced by the SAME EnforceBoundConstraints path a pushed constraint uses.

statement ok
CREATE TABLE main.gcol(id INT, title VARCHAR, secret VARCHAR);

query I
GRANT SELECT (id, title) ON main.gcol TO grantee1;
----
GRANT

# Allowed columns -> allow.
query I
SELECT birdshot_authorize('gsess', 'SELECT id, title FROM main.gcol');
----
true

# A non-allowed column -> deny (secret is outside the allow-list).
query I
SELECT birdshot_authorize('gsess', 'SELECT secret FROM main.gcol');
----
false

# A star pulls in secret -> deny.
query I
SELECT birdshot_authorize('gsess', 'SELECT * FROM main.gcol');
----
false

# REVOKE with the column list removes BOTH the base grant and the constraint.
query I
REVOKE SELECT (id, title) ON main.gcol FROM grantee1;
----
REVOKE

# Grant gone -> even an allowed column now denies (no base read grant).
query I
SELECT birdshot_authorize('gsess', 'SELECT id FROM main.gcol');
----
false

# ---- Tier 1: column lists on WRITES (UPDATE target columns) ------------------
# INSERT/UPDATE target columns are charged into read_cols by the bind-walk, so the
# same allow-list restricts which columns a write may touch.

query I
GRANT SELECT ON main.gcol TO grantee1;
----
GRANT

query I
GRANT UPDATE (title) ON main.gcol TO grantee1;
----
GRANT

# UPDATE of an allowed column -> allow.
query I
SELECT birdshot_authorize('gsess', 'UPDATE main.gcol SET title = ''x''');
----
true

# UPDATE of a non-allowed column -> deny (secret outside the allow-list).
query I
SELECT birdshot_authorize('gsess', 'UPDATE main.gcol SET secret = ''x''');
----
false

# ---- Tier 2: ALL TABLES IN SCHEMA -> wildcard <schema>.* --------------------

statement ok
CREATE SCHEMA gtsch;

statement ok
CREATE TABLE gtsch.ta(a INT);

statement ok
CREATE TABLE gtsch.tb(b INT);

query I
GRANT SELECT ON ALL TABLES IN SCHEMA gtsch TO grantee1;
----
GRANT

# The one wildcard grant covers EVERY table in the schema.
query I
SELECT birdshot_authorize('gsess', 'SELECT * FROM gtsch.ta');
----
true

query I
SELECT birdshot_authorize('gsess', 'SELECT * FROM gtsch.tb');
----
true

# The wildcard is catalog-AGNOSTIC by design (`*.gtsch.*`): it matches an EXPLICITLY
# catalog-qualified ref too, via the schema segment. (A plain control-plane `gtsch.*`
# push stays catalog-SENSITIVE and would NOT match this — see RefMatch; that asymmetry
# preserves the compiler's fail-closed cold-cache invariant.)
query I
SELECT birdshot_authorize('gsess', 'SELECT * FROM memory.gtsch.ta');
----
true

# A table in a DIFFERENT schema, with NO grant at all, is not covered by gtsch.* ->
# deny. (Unmasked negative: gnope has no grant/constraint, so this deny can ONLY be
# "gtsch.* did not match" — it would fail if the wildcard ever over-matched.)
statement ok
CREATE TABLE main.gnope(x INT);

query I
SELECT birdshot_authorize('gsess', 'SELECT * FROM main.gnope');
----
false

# ---- Tier 3: PUBLIC reaches every identity (incl. a role-less user) ----------

statement ok
CREATE TABLE main.gpub(id INT);

# Authenticate "norole" — a subject with NO roles/grants at all.
query I
SELECT birdshot_authenticate('nrsess', 'norole-tok', '');
----
true

# Before the PUBLIC grant: default-deny for the role-less user.
query I
SELECT birdshot_authorize('nrsess', 'SELECT * FROM main.gpub');
----
false

query I
GRANT SELECT ON main.gpub TO PUBLIC;
----
GRANT

# PUBLIC reaches the role-less user (the enforcement-hot-path merge).
query I
SELECT birdshot_authorize('nrsess', 'SELECT * FROM main.gpub');
----
true

# …and a user WITH roles too.
query I
SELECT birdshot_authorize('gsess', 'SELECT * FROM main.gpub');
----
true

# Revoking PUBLIC removes it for EVERYONE.
query I
REVOKE SELECT ON main.gpub FROM PUBLIC;
----
REVOKE

query I
SELECT birdshot_authorize('nrsess', 'SELECT * FROM main.gpub');
----
false

query I
SELECT birdshot_authorize('gsess', 'SELECT * FROM main.gpub');
----
false

# ---- Tier 4: WITH GRANT OPTION / GRANTED BY (stored, accepted, no error) -----

statement ok
CREATE TABLE main.gwgo(id INT);

# WITH GRANT OPTION parses + stores; the grant itself still takes effect.
query I
GRANT SELECT ON main.gwgo TO grantee1 WITH GRANT OPTION;
----
GRANT

query I
SELECT birdshot_authorize('gsess', 'SELECT * FROM main.gwgo');
----
true

# GRANTED BY parses + stores; grant takes effect.
query I
GRANT SELECT ON main.gwgo TO grantee1 GRANTED BY someadmin;
----
GRANT

query I
SELECT birdshot_authorize('gsess', 'SELECT * FROM main.gwgo');
----
true

# ---- Tier 5: CASCADE / RESTRICT on REVOKE (accepted; plain scoped revoke) ----

statement ok
CREATE TABLE main.gcasc(id INT);

query I
GRANT SELECT ON main.gcasc TO grantee1;
----
GRANT

query I
REVOKE SELECT ON main.gcasc FROM grantee1 CASCADE;
----
REVOKE

query I
SELECT birdshot_authorize('gsess', 'SELECT * FROM main.gcasc');
----
false

query I
GRANT SELECT ON main.gcasc TO grantee1;
----
GRANT

query I
REVOKE SELECT ON main.gcasc FROM grantee1 RESTRICT;
----
REVOKE

query I
SELECT birdshot_authorize('gsess', 'SELECT * FROM main.gcasc');
----
false

# ---- WIRE-DENY holds for a COLUMN-LIST GRANT (mandatory security re-check) ---
# A wire-submitted column-list GRANT is denied fail-closed AND is ineffective.

statement ok
CREATE TABLE main.gwire(id INT, title VARCHAR);

query I
SELECT birdshot_authorize('gsess', 'GRANT SELECT (id) ON main.gwire TO grantee1');
----
false

# …and it did not take effect: the subsequent SELECT is still denied.
query I
SELECT birdshot_authorize('gsess', 'SELECT id FROM main.gwire');
----
false

# ==========================================================================
# Native DENY / UNDENY — deny-wins ACL (spec DENY), standalone (memory mode)
# ==========================================================================
#
# A use is authorized iff (some GRANT matches) AND (no DENY matches). A DENY beats a
# GRANT regardless of grant specificity (deny-wins-always). DENY is a first-class SQL
# statement stored/hydrated exactly like GRANT; here we exercise the standalone native
# path (gsess = grantee1, still memory mode so no store epoch is required).

statement ok
CREATE SCHEMA sales;

statement ok
CREATE TABLE sales.orders(id INT, amt INT);

statement ok
CREATE TABLE sales.pii(id INT, ssn VARCHAR);

# ---- schema-wide GRANT + table DENY (via ROLE r): allow orders, deny pii ------
# GRANT SELECT ON ALL TABLES IN SCHEMA sales (wildcard *.sales.*) then DENY the pii table.
query I
GRANT SELECT ON ALL TABLES IN SCHEMA sales TO ROLE r;
----
GRANT

query I
DENY SELECT ON sales.pii TO ROLE r;
----
DENY

query I
GRANT r TO grantee1;
----
GRANT

# member of r: allowed on a non-denied table covered by the schema-wide grant…
query I
SELECT birdshot_authorize('gsess', 'SELECT * FROM sales.orders');
----
true

# …but DENIED on sales.pii — the DENY overrides the schema-wide grant (deny-wins).
query I
SELECT birdshot_authorize('gsess', 'SELECT * FROM sales.pii');
----
false

# ---- deny-wins over a MORE-SPECIFIC same-ref grant ---------------------------
# grantee1 gets an EXACT grant on sales.pii; the ROLE-level DENY still wins.
query I
GRANT SELECT ON sales.pii TO grantee1;
----
GRANT

query I
SELECT birdshot_authorize('gsess', 'SELECT * FROM sales.pii');
----
false

# ---- UNDENY restores access (the grants are still present) -------------------
query I
UNDENY SELECT ON sales.pii FROM ROLE r;
----
UNDENY

query I
SELECT birdshot_authorize('gsess', 'SELECT * FROM sales.pii');
----
true

# ---- deny-wins when GRANT and DENY name the SAME grantee directly ------------
statement ok
CREATE TABLE sales.direct(id INT);

query I
GRANT SELECT ON sales.direct TO grantee1;
----
GRANT

query I
SELECT birdshot_authorize('gsess', 'SELECT * FROM sales.direct');
----
true

query I
DENY SELECT ON sales.direct TO grantee1;
----
DENY

# grant present, deny present on the same (grantee, ref) -> DENIED (deny-wins).
query I
SELECT birdshot_authorize('gsess', 'SELECT * FROM sales.direct');
----
false

query I
UNDENY SELECT ON sales.direct FROM grantee1;
----
UNDENY

query I
SELECT birdshot_authorize('gsess', 'SELECT * FROM sales.direct');
----
true

# ---- PARSE-WALK deny-wins (DDL plane): DENY overrides a DROP grant -----------
# birdshot_authorize only CHECKS (never executes), so main.gtab survives every call.
query I
GRANT DROP ON main.gtab TO grantee1;
----
GRANT

query I
SELECT birdshot_authorize('gsess', 'DROP TABLE main.gtab');
----
true

query I
DENY DROP ON main.gtab TO grantee1;
----
DENY

# deny-wins in the PARSE-WALK (DDL) plane, not just the bind-walk.
query I
SELECT birdshot_authorize('gsess', 'DROP TABLE main.gtab');
----
false

query I
UNDENY DROP ON main.gtab FROM grantee1;
----
UNDENY

query I
SELECT birdshot_authorize('gsess', 'DROP TABLE main.gtab');
----
true

# ---- WIRE-DENY holds for a DENY statement (mandatory security re-check) ------
# The parser now claims DENY, so a wire-submitted DENY is auto-denied by the same
# bare-parser-throws gate as a wire GRANT — a token can never author a deny either.
query I
SELECT birdshot_authorize('gsess', 'DENY SELECT ON sales.orders TO grantee1');
----
false

# …and it was ineffective: grantee1 still reads sales.orders (deny never applied).
query I
SELECT birdshot_authorize('gsess', 'SELECT * FROM sales.orders');
----
true

# ---- fail-closed: unenforced privilege in a DENY is a hard error -------------
statement error
DENY TRIGGER ON sales.orders TO grantee1;
----
unknown or unenforced privilege

# ---- deferred: a column list on DENY is out of scope (clear error) -----------
statement error
DENY SELECT (ssn) ON sales.pii TO grantee1;
----
column lists on DENY

# ==========================================================================
# Lazy grant-store hydration (spec §12b/§12c) — local-table backend
# ==========================================================================
#
# A "table" store holds raw GRANT SQL keyed by grantee. birdshot_authenticate
# lazy-pulls a subject's rows (∪ PUBLIC ∪ transitively each granted role's rows)
# the FIRST time it binds that subject, parses each row through the native GRANT
# path (parse-ONLY, never executed), and applies the result to live State — so a
# subject birdshot has NEVER seen a scalar grant for is enforced on the next
# authorize. Any store error / unparseable row FAILS CLOSED (subject poisoned ->
# denied). The store table stays unaddressable to any wire token in BOTH planes.

# Rebuild the protected store fixture with the real cross-language column contract.
statement ok
DROP TABLE __birdshot_grants;

statement ok
CREATE TABLE __birdshot_grants(grantee_kind VARCHAR, grantee VARCHAR, stmt VARCHAR, version BIGINT);

# §12d freshness gate: in table mode the store epoch is REQUIRED (fail-closed — every
# authorize reads __birdshot_meta; a missing/unreadable epoch DENIES). This static row
# (epoch=0, never bumped) means exactly one hydration and no re-hydration, so the
# assertions below hold unchanged while still exercising the freshness read path. A
# separate case further down BUMPS this epoch to prove REVOKE takes effect.
statement ok
CREATE TABLE __birdshot_meta(epoch BIGINT);

statement ok
INSERT INTO __birdshot_meta VALUES (0);

statement ok
CREATE TABLE main.hyd(id INT, title VARCHAR);

# A role-only table (NO public/subject grant) so the transitive-role path is tested in
# ISOLATION — a bare `TO r1` here would silently key to the subject-self-role of "r1"
# (which bob, a member of the ROLE r1, never holds) and under-enforce; the store contract
# is that a grantee_kind='role' row's stmt MUST use `TO ROLE <r>` (§12a/§12f).
statement ok
CREATE TABLE main.hrole(id INT, title VARCHAR);

# alice: a direct subject grant (no scalar birdshot_add_role_grant ever ran for her).
statement ok
INSERT INTO __birdshot_grants VALUES ('subject', 'alice', 'GRANT SELECT ON main.hyd TO alice', 0);

# alice-ONLY table (no PUBLIC, no role grant): her access is reachable ONLY via her
# direct subject grant, so the §12d freshness case below can REVOKE it and observe a
# genuine deny (revoking her grant on main.hyd would NOT deny her — PUBLIC still covers it).
statement ok
CREATE TABLE main.asolo(id INT, title VARCHAR);

statement ok
INSERT INTO __birdshot_grants VALUES ('subject', 'alice', 'GRANT SELECT ON main.asolo TO alice', 0);

# bob: role membership + the role's own grant on a PUBLIC-free table -> transitive
# hydration, genuinely isolated (bob reaches main.hrole ONLY via role r1).
statement ok
INSERT INTO __birdshot_grants VALUES ('subject', 'bob', 'GRANT r1 TO bob', 0);

statement ok
INSERT INTO __birdshot_grants VALUES ('role', 'r1', 'GRANT SELECT ON main.hrole TO ROLE r1', 0);

# PUBLIC: must reach a subject with no subject/role rows of its own (carol).
statement ok
INSERT INTO __birdshot_grants VALUES ('public', '', 'GRANT SELECT ON main.hyd TO PUBLIC', 0);

# mallory: a non-GRANT store row (parser -> DISPLAY_ORIGINAL_ERROR) -> fail-closed poison.
statement ok
INSERT INTO __birdshot_grants VALUES ('subject', 'mallory', 'DROP TABLE main.hyd', 0);

# mo: a GRANT-shaped but MALFORMED row (parser -> DISPLAY_EXTENSION_ERROR) exercises the
# OTHER parse-failure branch; must ALSO fail closed even though a VALID grant precedes it
# in the same key (per-key all-or-nothing: one bad row denies the whole subject).
statement ok
INSERT INTO __birdshot_grants VALUES ('subject', 'mo', 'GRANT SELECT ON main.hyd TO mo', 0);

statement ok
INSERT INTO __birdshot_grants VALUES ('subject', 'mo', 'GRANT bogus_priv ON main.hyd TO mo', 0);

# dx: a DRIFTED row — grantee_kind='subject'/'dx' (the pull key) but the stmt applies to
# ROLE rr (the apply key). dx is a member of rr, so dx reaches main.drift via rr. This
# distinguishes the flush keying: apply writes role_key `rr`; a column-based flush would
# erase `subject-self-role(dx)` and STRAND the rr grant past a delete-on-revoke (fail OPEN).
# FlushHydrated erases the APPLIED role_key (rr), so the §12d case below denies correctly.
statement ok
CREATE TABLE main.drift(id INT, title VARCHAR);

statement ok
INSERT INTO __birdshot_grants VALUES ('subject', 'dx', 'GRANT rr TO dx', 0);

statement ok
INSERT INTO __birdshot_grants VALUES ('subject', 'dx', 'GRANT SELECT ON main.drift TO ROLE rr', 0);

# ---- config: service tokens bind sessions to the store subjects -------------
query I
SELECT birdshot_reset_config();
----
ok

query I
SELECT birdshot_set_auth('', '', 'dev');
----
ok

query I
SELECT birdshot_add_service_token('hy-alice', 'alice');
----
ok

query I
SELECT birdshot_add_service_token('hy-bob', 'bob');
----
ok

query I
SELECT birdshot_add_service_token('hy-carol', 'carol');
----
ok

query I
SELECT birdshot_add_service_token('hy-mallory', 'mallory');
----
ok

query I
SELECT birdshot_add_service_token('hy-mo', 'mo');
----
ok

query I
SELECT birdshot_add_service_token('hy-dx', 'dx');
----
ok

query I
SELECT birdshot_commit_config();
----
ok

# Select the table store AFTER commit. Hydration writes direct-to-live, so no
# birdshot_commit_config() may follow any authenticate below (it would clobber).
query I
SELECT birdshot_set_grant_store('table', ':memory:');
----
table

# ---- authenticate triggers the lazy pull (subjects birdshot has never seen) --
query I
SELECT birdshot_authenticate('hsa', 'hy-alice', '');
----
true

query I
SELECT birdshot_authenticate('hsb', 'hy-bob', '');
----
true

query I
SELECT birdshot_authenticate('hsc', 'hy-carol', '');
----
true

# mallory / mo still bind a session (fail-closed is enforced at authorize, not here).
query I
SELECT birdshot_authenticate('hsm', 'hy-mallory', '');
----
true

query I
SELECT birdshot_authenticate('hso', 'hy-mo', '');
----
true

# alice: direct subject grant enforced — proves lazy hydration (no scalar grant existed).
query I
SELECT birdshot_authorize('hsa', 'SELECT id FROM main.hyd');
----
true

# bob: transitive role r1 grant enforced on the PUBLIC-free table — this can ONLY pass
# via the role path (no PUBLIC/subject grant on main.hrole), so it genuinely isolates it.
query I
SELECT birdshot_authorize('hsb', 'SELECT id FROM main.hrole');
----
true

# carol (PUBLIC only, no role) is DENIED on main.hrole — proves the role path is what
# gives bob access there, and that PUBLIC does NOT leak onto the role-only table.
query I
SELECT birdshot_authorize('hsc', 'SELECT id FROM main.hrole');
----
false

# carol: only PUBLIC reaches her (no subject/role rows) — allowed on the PUBLIC table.
query I
SELECT birdshot_authorize('hsc', 'SELECT id FROM main.hyd');
----
true

# FAIL-CLOSED: mallory's malformed store row poisons her -> DENIED, even though the
# PUBLIC grant would otherwise cover this exact read.
query I
SELECT birdshot_authorize('hsm', 'SELECT id FROM main.hyd');
----
false

# FAIL-CLOSED (other branch): mo's malformed GRANT row poisons him -> DENIED, even
# though a valid `GRANT SELECT ON main.hyd TO mo` sits in the SAME key before it.
query I
SELECT birdshot_authorize('hso', 'SELECT id FROM main.hyd');
----
false

# A subject with no store rows at all is a clean empty hydration (NOT poison): it is
# simply un-granted -> default-deny (not a store error).
query I
SELECT birdshot_authorize('hsa', 'SELECT id FROM main.nope');
----
false

# PROTECTION HOLDS in both planes: a wire token can never read the store table,
# even the very subject whose grants it holds, and even column-projected.
query I
SELECT birdshot_authorize('hsa', 'SELECT * FROM __birdshot_grants');
----
false

query I
SELECT birdshot_authorize('hsa', 'SELECT stmt FROM __birdshot_grants WHERE grantee = ''alice''');
----
false

# ==========================================================================
# Freshness gate (spec §12d) — strong per-query epoch, fail-closed
# ==========================================================================
#
# Every authorize (table mode) reads __birdshot_meta.epoch. When it advances past
# the epoch birdshot last flushed-and-rehydrated at, the WHOLE hydrated cache is
# flushed GLOBALLY (once) and each subject is re-hydrated lazily on its next
# authorize. A store-side REVOKE therefore takes effect WITHOUT re-authenticating.

# ---- unchanged epoch (0): no spurious re-hydration, prior decisions hold -----
# Asserted BEFORE any bump so these pass because the cache is untouched (not merely
# because a re-hydrate happened to re-grant). alice + carol were hydrated above.
query I
SELECT birdshot_authorize('hsa', 'SELECT id FROM main.asolo');
----
true

query I
SELECT birdshot_authorize('hsc', 'SELECT id FROM main.hyd');
----
true

# ---- store-side REVOKE + epoch bump -> deny on the NEXT query ----------------
# Append a REVOKE row for alice at a HIGHER version (append-only writer, §12d
# strategy a). ORDER BY version applies GRANT(v0) then REVOKE(v1) -> RevokeLive
# nets to no grant. version is BIGINT; alice's original asolo grant row is version 0.
statement ok
INSERT INTO __birdshot_grants VALUES ('subject', 'alice', 'REVOKE SELECT ON main.asolo FROM alice', 1);

# Bump the epoch. This is the ONLY signal; no re-authenticate, no config reload.
statement ok
UPDATE __birdshot_meta SET epoch = 1;

# alice's NEXT authorize (same session hsa) now DENIES on her formerly-granted
# alice-only table: epoch advanced -> global flush -> alice re-hydrates GRANT then
# REVOKE in version order -> revoked. (Her PUBLIC access to main.hyd is untouched.)
query I
SELECT birdshot_authorize('hsa', 'SELECT id FROM main.asolo');
----
false

# CROSS-SUBJECT NON-STRANDING: the flush was GLOBAL (it cleared carol's PUBLIC key
# and bob's role key too), but re-hydrate is PER-AUTHORIZE, so carol and bob are
# re-populated on their own next query — NOT silently stranded by alice's bump.
query I
SELECT birdshot_authorize('hsc', 'SELECT id FROM main.hyd');
----
true

query I
SELECT birdshot_authorize('hsb', 'SELECT id FROM main.hrole');
----
true

# Idempotent at the same epoch: alice stays denied, carol stays allowed (no churn).
query I
SELECT birdshot_authorize('hsa', 'SELECT id FROM main.asolo');
----
false

query I
SELECT birdshot_authorize('hsc', 'SELECT id FROM main.hyd');
----
true

# ---- fail-closed: epoch unreadable -> DENY (table mode requires the epoch) ----
# Drop the meta table; the epoch read now fails -> every table-mode authorize denies,
# even for a subject (carol) that is cleanly hydrated and granted via PUBLIC.
statement ok
DROP TABLE __birdshot_meta;

query I
SELECT birdshot_authorize('hsc', 'SELECT id FROM main.hyd');
----
false

# Restore the meta table (epoch back at 1, matching hydrated_epoch_): reads succeed
# again, no flush, and carol is served from the still-warm cache -> allowed.
statement ok
CREATE TABLE __birdshot_meta(epoch BIGINT);

statement ok
INSERT INTO __birdshot_meta VALUES (1);

query I
SELECT birdshot_authorize('hsc', 'SELECT id FROM main.hyd');
----
true

# ---- flush keying: delete-on-revoke of a DRIFTED grant must take effect -------
# dx reaches main.drift via role rr — a grant whose store column is subject/dx but whose
# stmt applies TO ROLE rr (apply key = rr). Authenticate; the first query hydrates dx at
# the current epoch (1 == hydrated_epoch_, so no flush, just ensure_hydrated).
query I
SELECT birdshot_authenticate('hsdx', 'hy-dx', '');
----
true

query I
SELECT birdshot_authorize('hsdx', 'SELECT id FROM main.drift');
----
true

# Delete-on-revoke: drop the drift grant row (keep the rr membership) and bump the epoch.
# There is NO appended REVOKE row, so the ONLY way the next query denies is if FlushHydrated
# erased the APPLIED role_key (rr). A column-based flush would erase subject-self-role(dx),
# strand the rr grant, and leave dx ALLOWED — a fail-OPEN this asserts against.
statement ok
DELETE FROM __birdshot_grants WHERE grantee = 'dx' AND stmt LIKE '%main.drift%';

statement ok
UPDATE __birdshot_meta SET epoch = 2;

query I
SELECT birdshot_authorize('hsdx', 'SELECT id FROM main.drift');
----
false

# ==========================================================================
# Hydrated DENY (spec §12) — store-row DENY, deny-wins + flush-on-epoch-bump
# ==========================================================================
#
# A DENY row in __birdshot_grants (grantee_kind/grantee like a GRANT row) is pulled +
# parsed (parse-only) + applied to role_denies, then enforced deny-wins. And on an epoch
# bump the whole hydrated cache — role_denies included — is flushed and re-pulled, so a
# store-side DENY add takes effect (fail-closed) and a store-side DENY delete lifts
# (proving denies flush; no stale deny lingers). Epoch is at 2 here (dx case above).

statement ok
CREATE TABLE main.hpii(id INT, ssn VARCHAR);

# alice gets a store GRANT on main.hpii (subject row); bump the epoch so the global flush
# + per-subject re-hydrate picks it up on her next authorize.
statement ok
INSERT INTO __birdshot_grants VALUES ('subject', 'alice', 'GRANT SELECT ON main.hpii TO alice', 3);

statement ok
UPDATE __birdshot_meta SET epoch = 3;

# Granted, no deny yet -> allowed.
query I
SELECT birdshot_authorize('hsa', 'SELECT id FROM main.hpii');
----
true

# ---- store DENY row pulled + enforced (deny-wins over the hydrated grant) -----
# no-fail-open-on-added-DENY: append a DENY row + bump epoch -> next query DENIES.
statement ok
INSERT INTO __birdshot_grants VALUES ('subject', 'alice', 'DENY SELECT ON main.hpii TO alice', 4);

statement ok
UPDATE __birdshot_meta SET epoch = 4;

query I
SELECT birdshot_authorize('hsa', 'SELECT id FROM main.hpii');
----
false

# ---- freshness: DELETE the DENY row + bump epoch -> denies FLUSH -> ALLOWS -----
# Proves FlushHydrated erases role_denies: no appended UNDENY row exists, so the ONLY
# way the next query allows is the flush dropping the hydrated deny and the re-pull
# (grant still present, deny gone) restoring access. A deny NOT flushed here would be
# fail-safe (over-deny) — but it would also break a legitimate lift, so we assert allow.
statement ok
DELETE FROM __birdshot_grants WHERE grantee = 'alice' AND stmt LIKE 'DENY%';

statement ok
UPDATE __birdshot_meta SET epoch = 5;

query I
SELECT birdshot_authorize('hsa', 'SELECT id FROM main.hpii');
----
true
